{
  "$schema": "http://json-schema.org/draft-07/schema#",
  "type": "object",
  "required": ["project", "original_request", "decomposed_tasks", "current_focus"],
  "properties": {
    "project": {
      "type": "string",
      "description": "プロジェクト名"
    },
    "original_request": {
      "type": "string",
      "description": "ユーザーからの元の指示"
    },
    "task_hierarchy": {
      "type": "object",
      "description": "タスクの階層構造（将来的な拡張用）",
      "properties": {
        "epics": {
          "type": "array",
          "items": {
            "type": "object",
            "properties": {
              "epic_id": {
                "type": "string",
                "pattern": "^E[0-9]{3}$"
              },
              "title": { "type": "string" },
              "stories": {
                "type": "array",
                "items": {
                  "type": "string",
                  "pattern": "^S[0-9]{3}$"
                }
              }
            }
          }
        },
        "stories": {
          "type": "array",
          "items": {
            "type": "object",
            "properties": {
              "story_id": {
                "type": "string",
                "pattern": "^S[0-9]{3}$"
              },
              "title": { "type": "string" },
              "tasks": {
                "type": "array",
                "items": {
                  "type": "string",
                  "pattern": "^T[0-9]{3}$"
                }
              }
            }
          }
        }
      }
    },
    "decomposed_tasks": {
      "type": "array",
      "items": {
        "type": "object",
        "required": ["id", "title", "description", "status", "dependencies"],
        "properties": {
          "id": {
            "type": "string",
            "pattern": "^T[0-9]{3}$",
            "description": "タスクID（T001形式）"
          },
          "title": {
            "type": "string",
            "description": "タスクタイトル"
          },
          "description": {
            "type": "string",
            "description": "タスクの詳細説明"
          },
          "status": {
            "type": "string",
            "enum": ["pending", "in_progress", "completed", "blocked"],
            "description": "タスクの状態"
          },
          "dependencies": {
            "type": "array",
            "items": {
              "type": "object",
              "properties": {
                "task_id": {
                  "type": "string",
                  "pattern": "^T[0-9]{3}$"
                },
                "type": {
                  "type": "string",
                  "enum": ["strong", "weak"],
                  "default": "strong"
                }
              },
              "required": ["task_id"]
            },
            "description": "依存するタスクIDと依存タイプのリスト"
          },
          "priority": {
            "type": "integer",
            "minimum": 1,
            "maximum": 5,
            "default": 3,
            "description": "優先度（1:最低 〜 5:最高）"
          },
          "estimated_hours": {
            "type": "number",
            "minimum": 0,
            "description": "見積もり時間（時間単位）"
          },
          "progress_percentage": {
            "type": "integer",
            "minimum": 0,
            "maximum": 100,
            "default": 0,
            "description": "進捗率（0-100%）"
          },
          "progress_state": {
            "type": "string",
            "enum": [
              "not_started",
              "planning",
              "in_development",
              "implementation_complete",
              "in_review",
              "review_complete",
              "in_testing",
              "completed"
            ],
            "default": "not_started",
            "description": "進捗状態"
          },
          "git_commits": {
            "type": "array",
            "items": {
              "type": "string"
            },
            "description": "関連するGitコミットハッシュのリスト"
          }
        }
      }
    },
    "current_focus": {
      "type": "string",
      "pattern": "^T[0-9]{3}$",
      "description": "現在フォーカスしているタスクID"
    }
  }
}